Name,Country,Role,Organization,Type,Category,Contribution,ImageUrl,WebsiteUrl,LinkedinUrl,KeyResourceRefs,KeyResourceUrls,trusted_source_id,peer_reviewed,vetting_body,data_quality_notes,status,deprecated_at,deprecated_reason,KeyResourceUrl
Bill Newhouse,United States,Cybersecurity Engineer,NIST NCCoE,Public,Government,Project lead for NIST NCCoE PQC migration practice guides (SP 1800-38 series); co-authored NIST IR 8547 on interoperability and FIPS 203/204/205 adoption; drives federal agency quantum-safe readiness.,https://ui-avatars.com/api/?name=Bill+Newhouse&background=0b0d17&color=22d3ee&size=128&bold=true,https://www.nccoe.nist.gov/,https://www.linkedin.com/in/cybernewhouse/,FIPS 203;FIPS 204;FIPS 205;NIST NCCoE SP 1800-38A;NIST NCCoE SP 1800-38B,https://csrc.nist.gov/pubs/fips/203/final; https://csrc.nist.gov/pubs/fips/204/final; https://csrc.nist.gov/pubs/fips/205/final,nist-csrc,no,NIST NCCoE,Proposed 2026-05-06: KeyResourceUrl renamed to KeyResourceRefs (contains doc labels); KeyResourceUrls column added with resolved canonical URLs.,active,,,
Blair Canavan,Canada,Director of Alliances – PKI and PQC Portfolio,Thales,Private,Industry Vendor,"Leads Thales PQC Partner Ecosystem and Quantum-Safe 360 Alliance (with IBM Consulting, Keyfactor, Quantinuum) to accelerate enterprise quantum-safe migrations; 30+ years of cybersecurity expertise driving crypto-agility readiness.",https://ui-avatars.com/api/?name=Blair+Canavan&background=0b0d17&color=a78bfa&size=128&bold=true,https://cpl.thalesgroup.com/,https://www.linkedin.com/in/blair-canavan-5b708a2/,HSBC-InfoSecGlobal-Thales-CryptographicInventory-2025;Samsung-Thales-ML-KEM-eSE-2026,https://cpl.thalesgroup.com/blog/encryption/quantum-readiness-collaborative-path-infosec-global-thales; https://semiconductor.samsung.com/news-events/tech-blog/s3sse2a-hardware-pqc-locks-in-security-for-the-quantum-era/,thales-research,no,,Proposed 2026-05-06: KeyResourceUrl renamed to KeyResourceRefs (contains doc labels); KeyResourceUrls column added with resolved canonical URLs.,active,,,
Fabiana Da Pieve,Italy,Programme and Policy Officer,European Commission (DG CNECT),Public,Government,Designs EU-wide PQC deployment policy at DG CNECT; co-leads the NIS cooperation group PQC workstream coordinating member-state quantum-safe transitions; bridges quantum physics research with cryptographic security policy including EuroQCI.,https://ui-avatars.com/api/?name=Fabiana+Da+Pieve&background=0b0d17&color=22d3ee&size=128&bold=true,https://digital-strategy.ec.europa.eu/,https://www.linkedin.com/in/fabiana-da-pieve-585b132a/,EU PQC Recommendation;EU-NIS-CG-Roadmap-v1.1;EUDI-Wallet-ARF,https://digital-strategy.ec.europa.eu/en/news/eu-reinforces-its-cybersecurity-post-quantum-cryptography; https://digital-strategy.ec.europa.eu/en/library/coordinated-implementation-roadmap-transition-post-quantum-cryptography; https://digital-strategy.ec.europa.eu/en/policies/eudi-wallet-implementation,ec,no,European Commission (DG CNECT),Proposed 2026-05-06: KeyResourceUrl renamed to KeyResourceRefs (contains doc labels); KeyResourceUrls column added with resolved canonical URLs.,active,,,
Prof Bill Buchanan OBE,United Kingdom,Professor of Applied Cryptography,Edinburgh Napier University,Academic,Standards,Creator of asecuritysite.com with 30+ books and 400+ research papers on PQC; OBE for services to cybersecurity (2017); FRSE; Top 2% of scientists globally (Stanford 2025); Times Higher Education 'Most Innovative Teacher' 2023; vocal advocate for FIPS 203/204/205 adoption.,https://ui-avatars.com/api/?name=Bill+Buchanan&background=0b0d17&color=60a5fa&size=128&bold=true,https://asecuritysite.com/,https://www.linkedin.com/in/billatnapier/,FIPS 203;FIPS 204;FIPS 205,https://csrc.nist.gov/pubs/fips/203/final; https://csrc.nist.gov/pubs/fips/204/final; https://csrc.nist.gov/pubs/fips/205/final,nist-csrc,no,,Proposed 2026-05-06: KeyResourceUrl renamed to KeyResourceRefs (contains doc labels); KeyResourceUrls column added with resolved canonical URLs.,active,,,
Éric Brier,France,CTO Cyber Defence Solutions,Thales Group,Private,Algorithm Inventor,CTO at Thales leading the team that co-designed FALCON (FIPS 206); Thales lab co-author of FALCON signature algorithm selected by NIST as PQC standard after six-year competition; research background in fault attacks and cryptographic implementations.,https://ui-avatars.com/api/?name=Eric+Brier&background=0b0d17&color=f59e0b&size=128&bold=true,https://www.thalesgroup.com/,https://www.linkedin.com/in/ericbrier/,FIPS 206,https://csrc.nist.gov/projects/pqc-dig-sig,nist-csrc,no,,Proposed 2026-05-06: KeyResourceUrl renamed to KeyResourceRefs (contains doc labels); KeyResourceUrls column added with resolved canonical URLs.,active,,,
Damien Stehlé,France,Professor; CryptoLab Research Director,ENS de Lyon; CryptoLab,Academic,Algorithm Inventor,"Co-designed ML-KEM (CRYSTALS-Kyber) and ML-DSA (CRYSTALS-Dilithium), two of three NIST PQC standards published in 2024. Founded CryptoLab's Lyon research center. ERC grant recipient for lattice-based cryptography research (LattAC project).",https://ui-avatars.com/api/?name=Damien+Stehle&background=0b0d17&color=10b981&size=128&bold=true,https://perso.ens-lyon.fr/damien.stehle/,https://www.linkedin.com/in/damien-stehl%C3%A9-0576351/,FIPS 203;FIPS 204,https://csrc.nist.gov/pubs/fips/203/final; https://csrc.nist.gov/pubs/fips/204/final,nist-csrc,no,,Proposed 2026-05-06: KeyResourceUrl renamed to KeyResourceRefs (contains doc labels); KeyResourceUrls column added with resolved canonical URLs.,active,,,
Pierre-Alain Fouque,France,Professor,Université de Rennes; IRISA/Inria,Academic,Algorithm Inventor,"Co-designer of FALCON (FN-DSA), NIST's lattice-based signature standard. Leads the CAPSULE team at IRISA/Inria focused on embedded security and cryptography. Coordinates the PQ-TLS project developing post-quantum HTTPS protocols.",https://ui-avatars.com/api/?name=Pierre-Alain+Fouque&background=0b0d17&color=10b981&size=128&bold=true,https://www.di.ens.fr/~fouque/,https://www.linkedin.com/in/pierre-alain-fouque-42b3841/,FIPS 206,https://csrc.nist.gov/projects/pqc-dig-sig,nist-csrc,no,,Proposed 2026-05-06: KeyResourceUrl renamed to KeyResourceRefs (contains doc labels); KeyResourceUrls column added with resolved canonical URLs.,active,,,
Adeline Roux-Langlois,France,CNRS Directrice de recherche,GREYC; Université de Caen Normandie,Academic,Standards,Specialist in lattice-based cryptography security proofs. Key contributions to post-quantum anonymous credentials (CRYPTO 2023) and practical post-quantum privacy signatures (ACM CCS 2024). PhD from ENS de Lyon under Damien Stehlé.,https://ui-avatars.com/api/?name=Adeline+Roux-Langlois&background=0b0d17&color=10b981&size=128&bold=true,https://langloi227.users.greyc.fr/,,FIPS 203;FIPS 204;ANSSI PQC Position Paper,https://csrc.nist.gov/pubs/fips/203/final; https://csrc.nist.gov/pubs/fips/204/final; https://cyber.gouv.fr/en/publications/anssi-views-post-quantum-cryptography-transition,nist-csrc,no,,Proposed 2026-05-06: KeyResourceUrl renamed to KeyResourceRefs (contains doc labels); KeyResourceUrls column added with resolved canonical URLs.,active,,,
Daniel J. Bernstein,United States,Research Professor; Personal Professor,University of Illinois Chicago;TU Eindhoven,Academic,Algorithm Inventor,"Coined the term ""post-quantum cryptography"" (2003); co-designed SPHINCS+ (now FIPS 205 / SLH-DSA, NIST standard) with Andreas Hülsing and team; co-designed Classic McEliece (NIST on-ramp finalist, oldest studied code-based KEM); co-designed NTRU Prime; creator of Curve25519, ChaCha20/Poly1305, and NaCl/libsodium cryptographic library.",https://ui-avatars.com/api/?name=Daniel+Bernstein&background=0b0d17&color=f59e0b&size=128&bold=true,https://cr.yp.to/,,FIPS 205,https://csrc.nist.gov/pubs/fips/205/final,nist-csrc,no,,Proposed 2026-05-06: KeyResourceUrl renamed to KeyResourceRefs (contains doc labels); KeyResourceUrls column added with resolved canonical URLs.,active,,,
Prof. Oded Regev,United States,Silver Professor of Computer Science,NYU Courant Institute of Mathematical Sciences,Academic,Algorithm Inventor,"Inventor of Learning With Errors (LWE, 2005) — the foundational hard problem underlying ML-KEM (Kyber) and ML-DSA (Dilithium); proved quantum reduction establishing LWE hardness; 2018 Gödel Prize for LWE work; ACM Fellow 2025; foundational figure in lattice-based cryptography theory.",https://ui-avatars.com/api/?name=Oded+Regev&background=0b0d17&color=f59e0b&size=128&bold=true,https://cims.nyu.edu/~regev/,,FIPS 203;FIPS 204;FIPS 206,https://csrc.nist.gov/pubs/fips/203/final; https://csrc.nist.gov/pubs/fips/204/final,nist-csrc,no,,Proposed 2026-05-06: KeyResourceUrl renamed to KeyResourceRefs (contains doc labels); KeyResourceUrls column added with resolved canonical URLs.,active,,,
Prof. Tanja Lange,Germany,Full Professor of Cryptology; Chair PQCrypto Steering Committee,TU Eindhoven,Academic,Algorithm Inventor,Full Professor of Cryptology at TU Eindhoven; co-designed NTRU Prime (NIST on-ramp finalist) with Daniel Bernstein; co-authored Classic McEliece papers; co-organized the inaugural PQCrypto workshop (2006) and chairs its steering committee; Scientific Director of Ei/PSI (Eindhoven Institute for Protection of Systems and Information); ERC grant recipient for post-quantum research.,https://ui-avatars.com/api/?name=Tanja+Lange&background=0b0d17&color=f59e0b&size=128&bold=true,https://hyperelliptic.org/tanja/,,NIST IR 8309;NIST IR 8413,https://nvlpubs.nist.gov/nistpubs/ir/2022/NIST.IR.8413-upd1.pdf,nist-news,no,,Proposed 2026-05-06: KeyResourceUrl renamed to KeyResourceRefs (contains doc labels); KeyResourceUrls column added with resolved canonical URLs.,active,,,
Paul van Brouwershaven,Netherlands,Chair; Founder & CEO,PKI Consortium;Digitorus,Private,Standards,"Chairs the PKI Consortium's Post-Quantum Cryptography Working Group and co-organises the annual PQC Conference series. Authored the PQC Maturity Model (PQCMM), a practical framework adopted by governments and enterprises to assess quantum-readiness and plan migration strategies. Founder and CEO of Digitorus with 25+ years in PKI and digital trust.",https://ui-avatars.com/api/?name=Paul+van+Brouwershaven&background=0b0d17&color=60a5fa&size=128&bold=true,https://www.digitorus.com/,https://www.linkedin.com/in/pvanbrouwershaven/,PKI-Consortium-PQC-2025;RFC 9802;RFC 9810,https://pkic.org/wg/pqc/pqccm/; https://www.rfc-editor.org/rfc/rfc9802; https://www.rfc-editor.org/rfc/rfc9810,pki-consortium,no,,Proposed 2026-05-06: KeyResourceUrl renamed to KeyResourceRefs (contains doc labels); KeyResourceUrls column added with resolved canonical URLs.,active,,,
Albert de Ruiter,Netherlands,Vice Chair; Policy Authority for PKI (PKIoverheid),PKI Consortium;Logius,Public,Government,"Vice Chair of the PKI Consortium and Policy Authority for PKI at Logius (Dutch Ministry of Internal Affairs); co-founded the PKI Consortium's annual PQC Conference series, a major international forum for PQC standardisation and adoption. Active member of the Dutch government's quantum-safe cryptography working group; teaches quantum-safe digital infrastructure governance at TU Delft.",https://ui-avatars.com/api/?name=Albert+de+Ruiter&background=0b0d17&color=22d3ee&size=128&bold=true,https://pkic.org/,https://www.linkedin.com/in/albert-de-ruiter-0006a83/,PKI-Consortium-PQC-2025;RFC 9802;RFC 9810,https://pkic.org/wg/pqc/pqccm/; https://www.rfc-editor.org/rfc/rfc9802; https://www.rfc-editor.org/rfc/rfc9810,pki-consortium,no,PKI Consortium,Proposed 2026-05-06: KeyResourceUrl renamed to KeyResourceRefs (contains doc labels); KeyResourceUrls column added with resolved canonical URLs.,active,,,
Sven Rajala,United States,Senior PKI & PQC Strategy Consultant,Keyfactor,Private,Industry Vendor,"Senior cybersecurity consultant at Keyfactor specialising in PKI automation and PQC readiness; leads quantum-safe migration strategy for enterprise clients. Hosts the KEYMASTER educational video series covering practical PQC implementation including hybrid certificates, ML-DSA/SLH-DSA signatures, and NIST SP 800-227 KEM guidance. Active presenter at PKI Consortium PQC Conferences.",https://ui-avatars.com/api/?name=Sven+Rajala&background=0b0d17&color=a78bfa&size=128&bold=true,https://www.keyfactor.com/,https://www.linkedin.com/in/international-pki-man-of-mystery/,HSBC-InfoSecGlobal-Thales-CryptographicInventory-2025;RFC 9802;draft-bonnell-lamps-chameleon-certs-07,https://cpl.thalesgroup.com/blog/encryption/quantum-readiness-collaborative-path-infosec-global-thales; https://www.rfc-editor.org/rfc/rfc9802; https://datatracker.ietf.org/doc/draft-bonnell-lamps-chameleon-certs/,thales-research,no,,Proposed 2026-05-06: KeyResourceUrl renamed to KeyResourceRefs (contains doc labels); KeyResourceUrls column added with resolved canonical URLs.,active,,,
Chris Bailey,United States,Board Chair,PKI Consortium;AppViewX,Private,Standards,"Board Chair of the PKI Consortium and founding member of both the CA/Browser Forum and PKI Consortium; a 25+ year digital trust and PKI veteran driving industry-wide quantum-safe readiness. Former SVP at Entrust; advocates urgently for rapid collective migration to post-quantum encryption, stating ""We have no choice but to transition quickly and collectively.""",https://ui-avatars.com/api/?name=Chris+Bailey&background=0b0d17&color=60a5fa&size=128&bold=true,,https://www.linkedin.com/in/christophertmbailey/,PKI-Consortium-PQC-2025;RFC 9802;RFC 9810,https://pkic.org/wg/pqc/pqccm/; https://www.rfc-editor.org/rfc/rfc9802; https://www.rfc-editor.org/rfc/rfc9810,pki-consortium,no,,Proposed 2026-05-06: KeyResourceUrl renamed to KeyResourceRefs (contains doc labels); KeyResourceUrls column added with resolved canonical URLs.,active,,,
Tomas Gustavsson,Sweden,Chief PKI Officer; Co-Founder,Keyfactor,Private,Industry Vendor,"Created EJBCA, the world's leading open-source enterprise PKI software, which now supports all NIST-standardized PQC algorithms (ML-KEM, ML-DSA, SLH-DSA). As Chief PKI Officer at Keyfactor and co-founder of PrimeKey, he has been a central voice on hybrid certificate migration and practical PQC readiness for enterprise PKI. He actively presents at global conferences and contributes to the PKI Consortium PQC working groups.",https://ui-avatars.com/api/?name=Tomas+Gustavsson&background=0b0d17&color=a78bfa&size=128&bold=true,https://www.keyfactor.com/,https://www.linkedin.com/in/tgustavsson/,HSBC-InfoSecGlobal-Thales-CryptographicInventory-2025;RFC 9802;draft-bonnell-lamps-chameleon-certs-07,https://cpl.thalesgroup.com/blog/encryption/quantum-readiness-collaborative-path-infosec-global-thales; https://www.rfc-editor.org/rfc/rfc9802; https://datatracker.ietf.org/doc/draft-bonnell-lamps-chameleon-certs/,thales-research,no,,Proposed 2026-05-06: KeyResourceUrl renamed to KeyResourceRefs (contains doc labels); KeyResourceUrls column added with resolved canonical URLs.,active,,,
David Hook,Australia,VP Software Engineering; Founder,Legion of the Bouncy Castle,Private,Industry Vendor,"Co-founded the Legion of the Bouncy Castle in 2000 — one of the most widely used open-source cryptographic API libraries in Java and C# — which integrated full NIST PQC standard support (ML-KEM, ML-DSA, SLH-DSA) through 2024. He led the FIPS 140-2/3 certifications of Bouncy Castle's Java and C# APIs and presents extensively on hybrid PQC techniques, stateless PQC digital signatures, and Key Encapsulation Mechanisms. His work makes enterprise-grade PQC accessible to millions of developers globally.",https://ui-avatars.com/api/?name=David+Hook&background=0b0d17&color=a78bfa&size=128&bold=true,https://www.bouncycastle.org/,https://www.linkedin.com/in/david-hook-29b720/,draft-bonnell-lamps-chameleon-certs-07,https://datatracker.ietf.org/doc/draft-bonnell-lamps-chameleon-certs/,ietf,no,,Proposed 2026-05-06: KeyResourceUrl renamed to KeyResourceRefs (contains doc labels); KeyResourceUrls column added with resolved canonical URLs.,active,,,
Corey Bonnell,United States,Technology Strategist,DigiCert,Private,Standards,"Active co-author in the IETF LAMPS Working Group and originator of the Chameleon Certificates Internet-Draft (draft-bonnell-lamps-chameleon-certs), which enables paired classical/PQC certificate structures for phased quantum migration. He co-authored the IETF PQC for Engineers guidance document and contributes to standardizing how ML-DSA, SLH-DSA, and composite algorithms are encoded in X.509 certificates. He represents DigiCert in CA/Browser Forum, X9, and IETF standards bodies.",https://ui-avatars.com/api/?name=Corey+Bonnell&background=0b0d17&color=60a5fa&size=128&bold=true,https://www.digicert.com/,https://www.linkedin.com/in/coreybonnell/,draft-bonnell-lamps-chameleon-certs-07,https://datatracker.ietf.org/doc/draft-bonnell-lamps-chameleon-certs/,ietf,no,,Proposed 2026-05-06: KeyResourceUrl renamed to KeyResourceRefs (contains doc labels); KeyResourceUrls column added with resolved canonical URLs.,active,,,
John Gray,Canada,Software Developer (Architect),Entrust,Private,Standards,"Lead co-author of the IETF LAMPS Composite ML-DSA and Composite ML-KEM Internet-Drafts, which define how hybrid classical+PQC algorithms are encoded in X.509 certificates and CMS structures. His composite certificate standards work — together with Mike Ounsworth at Entrust — was adopted into the IETF standards track and represents the primary industry path for backward-compatible PQC certificate migration. He has published 3 RFCs and maintains 9+ active Internet-Drafts across LAMPS and related working groups.",https://ui-avatars.com/api/?name=John+Gray&background=0b0d17&color=60a5fa&size=128&bold=true,https://www.entrust.com/,https://www.linkedin.com/in/john-gray-aa281460/,draft-bonnell-lamps-chameleon-certs-07,https://datatracker.ietf.org/doc/draft-bonnell-lamps-chameleon-certs/,ietf,no,,Proposed 2026-05-06: KeyResourceUrl renamed to KeyResourceRefs (contains doc labels); KeyResourceUrls column added with resolved canonical URLs.,active,,,
Sudha E. Iyer,Ireland,Chief Cybersecurity Architect (Digital Assets and Data),Citi,Private,Industry Adopter,"Founding member of the FS-ISAC Post-Quantum Cryptography Working Group, representing the financial sector's largest global coordination effort on quantum migration readiness. As Chief Cybersecurity Architect at Citi with over 20 years of cryptographic architecture experience, she leads enterprise-scale PQC adoption strategy at one of the world's largest financial institutions. She also serves as International Project Leader at ISO for smart contract and blockchain security standardization, and speaks internationally on PQC readiness in regulated industries.",https://ui-avatars.com/api/?name=Sudha+Iyer&background=0b0d17&color=10b981&size=128&bold=true,https://www.fsisac.com/knowledge/pqc,https://www.linkedin.com/in/sudhaeiyer/,Europol-FS-ISAC-PQC-Financial-2026;NIST CSWP 39,https://www.europol.europa.eu/publications-events/publications/prioritising-post-quantum-cryptography-migration-activities-in-financial-services; https://nvlpubs.nist.gov/nistpubs/CSWP/NIST.CSWP.39.pdf,,no,,Proposed 2026-05-06: KeyResourceUrl renamed to KeyResourceRefs (contains doc labels); KeyResourceUrls column added with resolved canonical URLs.,active,,,
Tadahiko Ito,Japan,Senior Researcher,SECOM CO. LTD.,Private,Standards,"Senior Researcher at SECOM specializing in cryptographic key management, PQC migration planning, and policy standardization, with IETF contributions including RFC 9336 (X.509 Extended Key Usage for document signing). He contributes to IETF PQC certificate migration guidance and the IETF Hackathon's pqc-certificates interoperability project, and co-authored a 2025 academic paper on the grand challenges of PQC blockchain migration. He is a regular speaker at international forums including the PKI Consortium PQC Conference and FS-ISAC APAC Summit.",https://ui-avatars.com/api/?name=Tadahiko+Ito&background=0b0d17&color=60a5fa&size=128&bold=true,https://www.secom.co.jp/english/,https://www.linkedin.com/in/tadahiko-ito-b1b674160/,Japan CRYPTREC Report 2024;PKI-Consortium-PQC-2025,https://www.cryptrec.go.jp/en/topics/cryptrec_20240712_c23report.html; https://pkic.org/wg/pqc/pqccm/,cryptrec,no,,Proposed 2026-05-06: KeyResourceUrl renamed to KeyResourceRefs (contains doc labels); KeyResourceUrls column added with resolved canonical URLs.,active,,,
Alison Becker,United States,Cryptographer,National Security Agency (NSA),Public,Government,"NSA cryptographer and co-author of RFC 9763, specifying algorithm identifiers for ML-KEM, ML-DSA, and SLH-DSA for use with the Commercial National Security Algorithm Suite 2.0 (CNSA 2.0); contributes to NSA public guidance on quantum-safe cryptography.",https://ui-avatars.com/api/?name=Alison+Becker&background=0b0d17&color=22d3ee&size=128&bold=true,https://www.nsa.gov/,,RFC-9763,https://www.rfc-editor.org/rfc/rfc9763,nsa-advisory,no,National Security Agency (NSA),Proposed 2026-05-06: KeyResourceUrl renamed to KeyResourceRefs (contains doc labels); KeyResourceUrls column added with resolved canonical URLs.,active,,,
Michael Jenkins,United States,Technical Director; Cryptographer,National Security Agency (NSA),Public,Government,NSA Technical Director and co-author of RFC 9763 defining algorithm identifiers for post-quantum algorithms in CNSA 2.0; contributor to NSA public guidance on quantum-safe cryptography transitions for national security systems.,https://ui-avatars.com/api/?name=Michael+Jenkins&background=0b0d17&color=22d3ee&size=128&bold=true,https://www.nsa.gov/,,RFC-9763,https://www.rfc-editor.org/rfc/rfc9763,nsa-advisory,no,National Security Agency (NSA),Proposed 2026-05-06: KeyResourceUrl renamed to KeyResourceRefs (contains doc labels); KeyResourceUrls column added with resolved canonical URLs.,active,,,
Rebecca Guthrie,United States,Cryptographer,National Security Agency (NSA),Public,Government,"NSA cryptographer and co-author of RFC 9763, establishing the algorithm identifiers for ML-KEM, ML-DSA, and SLH-DSA used in federal CNSA 2.0 implementations; contributes to standards underpinning U.S. national security PQC migration.",https://ui-avatars.com/api/?name=Rebecca+Guthrie&background=0b0d17&color=22d3ee&size=128&bold=true,https://www.nsa.gov/,,RFC-9763,https://www.rfc-editor.org/rfc/rfc9763,nsa-advisory,no,National Security Agency (NSA),Proposed 2026-05-06: KeyResourceUrl renamed to KeyResourceRefs (contains doc labels); KeyResourceUrls column added with resolved canonical URLs.,active,,,
Allen Roginsky,United States,Research Scientist,NIST,Public,Government,"NIST Computer Security Division researcher and co-author of NIST SP 800-131A Revision 3, providing guidance on transitioning cryptographic key lengths and algorithms to post-quantum standards across U.S. federal systems.",https://ui-avatars.com/api/?name=Allen+Roginsky&background=0b0d17&color=22d3ee&size=128&bold=true,https://csrc.nist.gov/,,NIST-SP-800-131A-Rev3,https://csrc.nist.gov/pubs/sp/800/131/a/r3/ipd,nist-csrc,no,NIST,Proposed 2026-05-06: KeyResourceUrl renamed to KeyResourceRefs (contains doc labels); KeyResourceUrls column added with resolved canonical URLs.,active,,,
Elaine Barker,United States,Research Scientist,NIST,Public,Government,"NIST researcher and co-author of NIST SP 800-131A Revision 3, guiding federal agencies on transitioning cryptographic key lengths and algorithms to post-quantum standards; long-time contributor to NIST SP 800-57 key management recommendations.",https://ui-avatars.com/api/?name=Elaine+Barker&background=0b0d17&color=22d3ee&size=128&bold=true,https://csrc.nist.gov/,,NIST-SP-800-131A-Rev3,https://csrc.nist.gov/pubs/sp/800/131/a/r3/ipd,nist-csrc,no,NIST,Proposed 2026-05-06: KeyResourceUrl renamed to KeyResourceRefs (contains doc labels); KeyResourceUrls column added with resolved canonical URLs.,active,,,
Suzanne Lightman,United States,Research Scientist; Project Lead,NIST NCCoE,Public,Government,"NIST NCCoE project lead and co-author of NIST SP 800-82 Revision 3 (Guide to Operational Technology Security); key contributor to guidance on OT/ICS PQC migration for critical infrastructure sectors including energy, manufacturing, and transportation.",https://ui-avatars.com/api/?name=Suzanne+Lightman&background=0b0d17&color=22d3ee&size=128&bold=true,https://www.nccoe.nist.gov/,,NIST SP 800-82 Rev. 3,https://csrc.nist.gov/pubs/sp/800/82/r3/final,nist-csrc,no,NIST NCCoE,Proposed 2026-05-06: KeyResourceUrl renamed to KeyResourceRefs (contains doc labels); KeyResourceUrls column added with resolved canonical URLs.,active,,,
Hannes Tschofenig,Germany,Professor; IETF Security Expert,Hochschule Bonn-Rhein-Sieg (H-BRS),Academic,Standards,"Professor at H-BRS and prolific IETF contributor; co-author of JOSE PQC KEM draft, DTLS 1.3 (RFC 9147), SUIT firmware update protocol (RFC 9019), and IoT device authentication standards; instrumental in bringing post-quantum cryptography to constrained IoT and embedded environments.",https://ui-avatars.com/api/?name=Hannes+Tschofenig&background=0b0d17&color=60a5fa&size=128&bold=true,https://www.h-brs.de/,,draft-ietf-jose-pqc-kem;RFC 9147;RFC 9019;RFC 7250,https://datatracker.ietf.org/doc/draft-ietf-jose-pqc-kem/; https://www.rfc-editor.org/rfc/rfc9147; https://www.rfc-editor.org/rfc/rfc9019; https://www.rfc-editor.org/rfc/rfc7250,ietf,no,,Proposed 2026-05-06: KeyResourceUrl renamed to KeyResourceRefs (contains doc labels); KeyResourceUrls column added with resolved canonical URLs.,active,,,
