Name,Country,Role,Organization,Type,Category,Contribution,ImageUrl,WebsiteUrl,LinkedinUrl,KeyResourceRefs,KeyResourceUrls,trusted_source_id,peer_reviewed,vetting_body,data_quality_notes,status,deprecated_at,deprecated_reason,KeyResourceUrl
Paul Bastian,Germany,Security Engineer; Standards Contributor,Bundesdruckerei (BDR),Private,Standards,"Co-author of the IETF Token Status List draft, defining scalable mechanisms for verifiable credential revocation in digital identity systems; employee of Bundesdruckerei (German federal security printing), driving quantum-safe government digital identity infrastructure.",https://ui-avatars.com/api/?name=Paul+Bastian&background=0b0d17&color=60a5fa&size=128&bold=true,https://www.bundesdruckerei.de/,,,,,,,,deprecated,2026-03-12,2026-03-13 leaders policy filter,IETF-Token-Status-List
Tobias Looker,New Zealand,Principal Cryptography Engineer,MATTR,Private,Standards,"Co-author of the IETF Token Status List draft; principal cryptography engineer at MATTR; expert in W3C Verifiable Credentials, DIF decentralized identity, and OpenID Connect for Verifiable Presentations; driving quantum-safe digital credential infrastructure.",https://ui-avatars.com/api/?name=Tobias+Looker&background=0b0d17&color=60a5fa&size=128&bold=true,https://mattr.global/,,,,,,,,deprecated,2026-03-12,2026-03-13 leaders policy filter,IETF-Token-Status-List
Emilia Kasper,Netherlands/USA,Software Engineer; Security Researcher,Google,Private,Standards,"Co-author of RFC 6962 (Certificate Transparency), the foundational PKI audit log mechanism being extended for PQC certificate monitoring; OpenSSL contributor; worked on early PQC experiments in Chrome alongside the Cloudflare team.",https://ui-avatars.com/api/?name=Emilia+Kasper&background=0b0d17&color=60a5fa&size=128&bold=true,https://www.google.com/,,,,,,,,deprecated,2026-03-12,2026-03-13 leaders policy filter,RFC 6962
Chris M. Lonvick,USA,Network Security Engineer; RFC Editor,Cisco Systems,Private,Standards,"Co-editor of SSH Architecture (RFC 4251) and SSH Transport Layer Protocol (RFC 4253), the foundational standards for SSH whose algorithms are primary targets in quantum-safe migration plans worldwide.",https://ui-avatars.com/api/?name=Chris+M+Lonvick&background=0b0d17&color=60a5fa&size=128&bold=true,https://www.cisco.com/,,,,,,,,deprecated,2026-03-12,2026-03-13 leaders policy filter,RFC 4251;IETF RFC 4253
Tatu Ylonen,Finland,Inventor of SSH; CEO,SSH Communications Security,Private,Algorithm Inventor,"Inventor of the Secure Shell (SSH) protocol (1995); co-editor of SSH RFC standards (RFC 4251–4253); founder of SSH Communications Security; his protocol is one of the primary migration targets in quantum-safe transition programs globally, protecting billions of server connections.",https://ui-avatars.com/api/?name=Tatu+Ylonen&background=0b0d17&color=f59e0b&size=128&bold=true,https://www.ssh.com/,,,,,,,,deprecated,2026-03-12,2026-03-13 leaders policy filter,IETF RFC 4253;RFC 4251
Ben Laurie,UK,Security Researcher,Google,Private,Standards,Co-inventor of Certificate Transparency (CT2 RFC 9162) at Google; contributor to quantum-safe PKI monitoring infrastructure; original OpenSSL developer; his CT log auditing mechanisms are being extended to support PQC certificate ecosystems.,https://ui-avatars.com/api/?name=Ben+Laurie&background=0b0d17&color=60a5fa&size=128&bold=true,https://www.google.com/,,,,,,,,deprecated,2026-03-12,2026-03-13 leaders policy filter,RFC 6962
Paul Hoffman,USA,Distinguished Engineer; IETF Veteran,ICANN,Private,Standards,Distinguished Engineer at ICANN and long-time IETF contributor; co-author of IKEv2 (RFC 7296) and numerous internet security RFCs; significant contributor to DNS security (DNSSEC) and quantum-safe protocol integration in core internet infrastructure.,https://ui-avatars.com/api/?name=Paul+Hoffman&background=0b0d17&color=60a5fa&size=128&bold=true,https://www.icann.org/,,,,,,,,deprecated,2026-03-12,2026-03-13 leaders policy filter,IETF RFC 7296
Charlie Kaufman,USA,Security Researcher; Standards Author,Microsoft,Private,Standards,"Primary author of IKEv2 (RFC 7296), the key negotiation protocol used in IPsec VPNs and a critical migration target for PQC-safe infrastructure; 30+ year contributor to internet security protocols and IETF security area working groups.",https://ui-avatars.com/api/?name=Charlie+Kaufman&background=0b0d17&color=60a5fa&size=128&bold=true,https://www.microsoft.com/,,,,,,,,deprecated,2026-03-12,2026-03-13 leaders policy filter,IETF RFC 7296
Paul Wouters,Netherlands/USA,Senior Software Engineer; IETF Expert,Red Hat,Private,Standards,Senior Engineer at Red Hat and active IETF contributor; co-author of RFC 7250 (Using Raw Public Keys in TLS) and contributor to IKEv2/IPsec PQC integration; leads Fedora/RHEL cryptography policy enabling PQC algorithm support across Linux distributions.,https://ui-avatars.com/api/?name=Paul+Wouters&background=0b0d17&color=60a5fa&size=128&bold=true,https://www.redhat.com/,,,,,,,,deprecated,2026-03-12,2026-03-13 leaders policy filter,RFC 7250
Rob Stradling,UK,Senior Research Engineer,Sectigo,Private,Standards,Senior Research Engineer at Sectigo and co-author of Certificate Transparency v2 (RFC 9162); contributor to crt.sh certificate transparency log search and the broader CT ecosystem that forms the verification backbone for PQC certificate deployment monitoring.,https://ui-avatars.com/api/?name=Rob+Stradling&background=0b0d17&color=60a5fa&size=128&bold=true,https://sectigo.com/,,,,,,,,deprecated,2026-03-12,2026-03-13 leaders policy filter,RFC-9162
John Gilmore,USA,Co-Founder; Cryptography Advocate,Electronic Frontier Foundation (EFF),Private,Standards,Co-founder of the Electronic Frontier Foundation (EFF) and cypherpunk; co-author of RFC 7250 (Using Raw Public Keys in TLS); early advocate for strong cryptography and export freedom; his work on minimal-state TLS authentication is relevant to constrained-environment PQC deployments.,https://ui-avatars.com/api/?name=John+Gilmore&background=0b0d17&color=60a5fa&size=128&bold=true,https://www.eff.org/,,,,,,,,deprecated,2026-03-12,2026-03-13 leaders policy filter,RFC 7250
Nat Sakimura,Japan,Research Fellow; OpenID Foundation Chairman Emeritus,Nomura Research Institute (NRI),Private,Standards,Co-author of JSON Web Signature (RFC 7515) and JSON Web Token (RFC 7519); lead designer of OpenID Connect; Chairman Emeritus of the OpenID Foundation; his identity token standards are fundamental migration targets for enterprise authentication requiring PQC-safe signatures.,https://ui-avatars.com/api/?name=Nat+Sakimura&background=0b0d17&color=60a5fa&size=128&bold=true,https://www.nri.com/,,,,,,,,deprecated,2026-03-12,2026-03-13 leaders policy filter,RFC 7515;RFC 7519
Brendan Moran,Ireland,Principal Architect; SUIT WG Co-Chair,Arm,Private,Standards,"Principal Architect at Arm and IETF SUIT Working Group co-chair; co-author of RFC 9019 (A Firmware Update Architecture for Internet of Things), defining secure firmware update mechanisms for IoT devices requiring PQC-safe signing as legacy hash-based algorithms are retired.",https://ui-avatars.com/api/?name=Brendan+Moran&background=0b0d17&color=60a5fa&size=128&bold=true,https://www.arm.com/,,,,,,,,deprecated,2026-03-12,2026-03-13 leaders policy filter,RFC 9019
Stephen Davidson,Canada,Standards Technology Strategist; S/MIME WG Chair,DigiCert,Private,Standards,Chair of the CA/Browser Forum S/MIME Certificate Working Group; proposed CA/Browser Forum Ballot SMC013 enabling ML-DSA and ML-KEM in S/MIME certificates; DigiCert representative driving post-quantum migration standards for email security and publicly-trusted PKI.,https://ui-avatars.com/api/?name=Stephen+Davidson&background=0b0d17&color=60a5fa&size=128&bold=true,https://www.digicert.com/,,,,,,,,deprecated,2026-03-12,2026-03-13 leaders policy filter,CA-B-Forum-Ballot-SMC013
Martijn Katerbarg,Netherlands,Principal Technologist; CA/Browser Forum Contributor,Sectigo,Private,Standards,Endorsed CA/Browser Forum Ballot SMC013 enabling ML-DSA and ML-KEM in S/MIME certificates; Sectigo representative to the CA/Browser Forum S/MIME Certificate Working Group; contributes to post-quantum certificate policy development for publicly-trusted certificate authorities.,https://ui-avatars.com/api/?name=Martijn+Katerbarg&background=0b0d17&color=60a5fa&size=128&bold=true,https://sectigo.com/,,,,,,,,deprecated,2026-03-12,2026-03-13 leaders policy filter,CA-B-Forum-Ballot-SMC013
Clint Wilson,USA,Security Engineer; CA/Browser Forum Contributor,Apple,Private,Standards,Apple's representative to the CA/Browser Forum root program; endorsed Ballot SMC013/SMC014 enabling PQC algorithms in S/MIME certificates; shapes root store policy decisions governing post-quantum certificate trust and algorithm transitions for billions of Apple devices worldwide.,https://ui-avatars.com/api/?name=Clint+Wilson&background=0b0d17&color=60a5fa&size=128&bold=true,https://www.apple.com/,,,,,,,,deprecated,2026-03-12,2026-03-13 leaders policy filter,CA-B-Forum-Ballot-SMC013
Ashish Dhiman,India,Principal Engineer; CA/Browser Forum Contributor,GlobalSign,Private,Standards,Endorsed CA/Browser Forum Ballot SMC013/SMC014 enabling post-quantum algorithms in S/MIME certificates; GlobalSign representative to the CA/Browser Forum driving adoption of ML-DSA and ML-KEM in publicly-trusted certificate authorities for quantum-safe email and document signing.,https://ui-avatars.com/api/?name=Ashish+Dhiman&background=0b0d17&color=60a5fa&size=128&bold=true,https://www.globalsign.com/,,,,,,,,deprecated,2026-03-12,2026-03-13 leaders policy filter,CA-B-Forum-Ballot-SMC013
Andreas Henschel,Germany,PKI Expert; CA/Browser Forum Contributor,D-Trust,Private,Standards,Endorsed CA/Browser Forum Ballot SMC013 enabling ML-DSA and ML-KEM in S/MIME certificates; D-Trust (BSI subsidiary) representative to the CA/Browser Forum; drives post-quantum certificate standards for German and European digital identity infrastructure.,https://ui-avatars.com/api/?name=Andreas+Henschel&background=0b0d17&color=60a5fa&size=128&bold=true,https://www.d-trust.net/,,,,,,,,deprecated,2026-03-12,2026-03-13 leaders policy filter,CA-B-Forum-Ballot-SMC013
Tony Cox,Australia,PKCS#11 Specification Editor; Security Standards Expert,Cryptsoft,Private,Standards,"Lead editor of PKCS#11 v3.0 and v3.2 Cryptographic Token Interface Standards at OASIS; founder of Cryptsoft; his specifications define the HSM programming interface used by all hardware security modules implementing post-quantum algorithms including ML-KEM, ML-DSA, and SLH-DSA.",https://ui-avatars.com/api/?name=Tony+Cox&background=0b0d17&color=60a5fa&size=128&bold=true,https://www.cryptsoft.com/,,,,,,,,deprecated,2026-03-12,2026-03-13 leaders policy filter,PKCS11-V3-OASIS;PKCS11-V32-OASIS
Robert Relyea,USA,Senior Software Engineer; PKCS#11 TC Chair,Red Hat,Private,Standards,"OASIS PKCS#11 Technical Committee Chair for v3.1 and v3.2; Red Hat cryptography engineer and NSS (Network Security Services) developer; leads standardization of PKCS#11 post-quantum cryptography mechanisms enabling ML-KEM, ML-DSA, and SLH-DSA in open-source HSM implementations.",https://ui-avatars.com/api/?name=Robert+Relyea&background=0b0d17&color=60a5fa&size=128&bold=true,https://www.redhat.com/,,,,,,,,deprecated,2026-03-12,2026-03-13 leaders policy filter,PKCS11-V32-OASIS;PKCS11-V31-OASIS
Dieter Bong,Germany,Engineering Lead; PKCS#11 Editor,Utimaco,Private,Standards,"Editor of PKCS#11 v3.2 at OASIS and contributor to v3.0; Utimaco HSM engineer responsible for defining C_EncapsulateKey and C_DecapsulateKey extensions and ML-KEM, ML-DSA, and SLH-DSA mechanism specifications enabling post-quantum operations in hardware security modules.",https://ui-avatars.com/api/?name=Dieter+Bong&background=0b0d17&color=60a5fa&size=128&bold=true,https://utimaco.com/,,,,,,,,deprecated,2026-03-12,2026-03-13 leaders policy filter,PKCS11-V32-OASIS;PKCS11-V31-OASIS
Valerie Fenwick,USA,Principal Engineer; PKCS#11 TC Chair,Oracle,Private,Standards,"OASIS PKCS#11 Technical Committee Chair for v3.2; Oracle cryptography engineer co-chairing standardization of post-quantum interfaces for hardware security modules; instrumental in incorporating ML-KEM, ML-DSA, and SLH-DSA mechanisms and new KEM function signatures into the PKCS#11 v3.2 standard.",https://ui-avatars.com/api/?name=Valerie+Fenwick&background=0b0d17&color=60a5fa&size=128&bold=true,https://www.oracle.com/,,,,,,,,deprecated,2026-03-12,2026-03-13 leaders policy filter,PKCS11-V32-OASIS;PKCS11-V3-OASIS
Luke Valenta,USA,Research Engineer; Cryptography Researcher,Cloudflare,Private,Industry Adopter,Co-author of Cloudflare's Merkle Tree Certificates proposal redesigning WebPKI for post-quantum authentication; contributor to the annual State of the Post-Quantum Internet research; leads Cloudflare's work on reducing TLS handshake sizes while enabling PQC certificate deployment at scale.,https://ui-avatars.com/api/?name=Luke+Valenta&background=0b0d17&color=10b981&size=128&bold=true,https://research.cloudflare.com/,,,,,,,,deprecated,2026-03-12,2026-03-13 leaders policy filter,Cloudflare-MTC-Blog;Cloudflare-PQ-Internet-2025
Christopher Patton,USA,Research Engineer; Cryptography Researcher,Cloudflare,Private,Industry Adopter,Co-author of Cloudflare's Merkle Tree Certificates proposal redesigning WebPKI for quantum-safe authentication; contributor to IETF PQUIP working group and IKEv2 post-quantum standardization; Cloudflare researcher advancing quantum-safe protocol deployment across the Internet.,https://ui-avatars.com/api/?name=Christopher+Patton&background=0b0d17&color=10b981&size=128&bold=true,https://research.cloudflare.com/,,,,,,,,deprecated,2026-03-12,2026-03-13 leaders policy filter,Cloudflare-MTC-Blog
Vânia Gonçalves,Portugal,Research Engineer; Cryptography Researcher,Cloudflare,Private,Industry Adopter,Co-author of Cloudflare's Merkle Tree Certificates proposal redesigning WebPKI for post-quantum cryptographic authentication; Cloudflare researcher contributing to the technical foundation for quantum-safe certificate deployment that dramatically reduces TLS handshake overhead from PQC signature sizes.,https://ui-avatars.com/api/?name=Vania+Goncalves&background=0b0d17&color=10b981&size=128&bold=true,https://research.cloudflare.com/,,,,,,,,deprecated,2026-03-12,2026-03-13 leaders policy filter,Cloudflare-MTC-Blog
Craig Gidney,USA,Senior Research Scientist; Quantum Software Engineer,Google Quantum AI,Private,Algorithm Inventor,"Google Quantum AI researcher whose work on quantum circuit optimization and Shor's algorithm resource estimation provides key benchmarks for the quantum computing power required to break RSA and elliptic curve cryptography; his published qubit count analyses directly inform PQC migration urgency timelines used by NIST, NSA, and global policymakers.",https://ui-avatars.com/api/?name=Craig+Gidney&background=0b0d17&color=f59e0b&size=128&bold=true,https://quantumai.google/,,,,,,,,deprecated,2026-03-12,2026-03-13 leaders policy filter,Cloudflare-PQ-Internet-2025
Valery Smyslov,Russia,Network Security Expert; IKEv2 Author,ELVIS-PLUS,Private,Standards,Author of RFC 9593 (Announcing Supported Authentication Methods in IKEv2) enabling PQC signature algorithm negotiation in IPsec VPNs; prolific IETF IPsecME working group contributor driving standardization of ML-KEM and ML-DSA integration in IKEv2 — the key protocol for enterprise VPN post-quantum migration.,https://ui-avatars.com/api/?name=Valery+Smyslov&background=0b0d17&color=60a5fa&size=128&bold=true,,,,,,,,,deprecated,2026-03-12,2026-03-13 leaders policy filter,RFC 9593
Marco Lucamarini,UK,Principal Research Scientist; QKD Expert,Toshiba Research Europe,Private,Algorithm Inventor,"Toshiba Research Europe QKD researcher and contributor to ETSI GS QKD 012; co-inventor of Twin-Field QKD, a breakthrough protocol that dramatically extends the distance over which quantum key distribution can operate beyond the repeaterless bound, enabling practical long-distance quantum-safe key exchange.",https://ui-avatars.com/api/?name=Marco+Lucamarini&background=0b0d17&color=f59e0b&size=128&bold=true,https://www.toshiba.eu/pages/eu/Cambridge-Research-Laboratory/,,,,,,,,deprecated,2026-03-12,2026-03-13 leaders policy filter,ETSI-GS-QKD-012
Bruno Huttner,Switzerland,Chief Quantum Officer,ID Quantique,Private,Industry Vendor,"Chief Quantum Officer at ID Quantique, the world's leading commercial QKD provider; contributor to ETSI GS QKD 014 REST-based Key Delivery API standard; drives commercial quantum key distribution deployment and integration of QKD with post-quantum cryptography in hybrid security architectures for financial, government, and critical infrastructure clients.",https://ui-avatars.com/api/?name=Bruno+Huttner&background=0b0d17&color=a78bfa&size=128&bold=true,https://www.idquantique.com/,,,,,,,,deprecated,2026-03-12,2026-03-13 leaders policy filter,ETSI-GS-QKD-014
Peter Bordow,USA,Distinguished Engineer; FS-ISAC PQC Workgroup Chair,Wells Fargo,Private,Industry Adopter,"Distinguished Engineer and Managing Director of Quantum Security at Wells Fargo; Chair of the FS-ISAC Post-Quantum Cryptography Workgroup leading the financial sector's collective response to quantum threats; drives PQC migration standards, best practices, and risk frameworks for the global financial services industry.",https://ui-avatars.com/api/?name=Peter+Bordow&background=0b0d17&color=10b981&size=128&bold=true,https://www.wellsfargo.com/,,,,,,,,deprecated,2026-03-12,2026-03-13 leaders policy filter,Europol-FS-ISAC-PQC-Financial-2026
Steve Stevens,USA,Executive Director,Accredited Standards Committee X9,Private,Standards,"Executive Director of ASC X9, the ANSI-accredited standards body for the US financial services industry. Leads X9 initiatives on post-quantum cryptography including the X9 Financial PKI (launched June 2025 with DigiCert), the X9 PQC Financial Readiness Needs Assessment, and the quantum computing risk study program. Drives cross-sector adoption of PQC standards for payment systems, PKI, and financial cryptographic infrastructure.",https://ui-avatars.com/api/?name=Steve+Stevens&background=0b0d17&color=60a5fa&size=128&bold=true,https://x9.org/,https://www.linkedin.com/in/steve-stevens-5b06892/,,,,,,,deprecated,2026-03-12,2026-03-13 leaders policy filter,ASC-X9-Financial-PKI;ASC-X9-PQC-Readiness-2025;ASC-X9-IR-F01-2022
Roy C. DeCicco,USA,"Former Chair, ASC X9; Managing Director",JPMorgan Chase,Private,Standards,Former Chair of ASC X9 (until 2021); led the committee during the development of foundational financial cryptography standards including the X9 TR 50-2019 on Quantum Techniques in CMS and the initial quantum computing risk assessment for the financial industry. Managing Director at JPMorgan Chase responsible for cryptographic standards and financial PKI governance.,https://ui-avatars.com/api/?name=Roy+C+DeCicco&background=0b0d17&color=60a5fa&size=128&bold=true,https://x9.org/,,,,,,,,deprecated,2026-03-12,2026-03-13 leaders policy filter,ASC-X9-TR-50-2019;ASC-X9-IR-F01-2022
Angela Hendershott,USA,Vice Chair,Accredited Standards Committee X9,Private,Standards,"Vice Chair of ASC X9; supports governance and standards development for the financial services industry including post-quantum cryptography transition initiatives. Contributes to X9 standards for financial PKI, cryptographic key management, and the quantum computing risk framework for financial institutions.",https://ui-avatars.com/api/?name=Angela+Hendershott&background=0b0d17&color=60a5fa&size=128&bold=true,https://x9.org/,,,,,,,,deprecated,2026-03-12,2026-03-13 leaders policy filter,ASC-X9-TR-50-2019
Shuichi Katsumata,UK,Lead Cryptography Researcher,PQShield,Private,Algorithm Inventor,Lead cryptography researcher at PQShield advancing lattice-based cryptography theory; contributor to ML-KEM security analysis and hybrid key exchange IETF standardization; his theoretical work on tightly-secure lattice signatures and modular lattice schemes strengthens the cryptographic foundations of NIST PQC standards.,https://ui-avatars.com/api/?name=Shuichi+Katsumata&background=0b0d17&color=f59e0b&size=128&bold=true,https://pqshield.com/,,,,,,,,deprecated,2026-03-12,2026-03-13 leaders policy filter,FIPS 203
Dr. Ludovic Barman,Switzerland,CTO,CryptoNext Security,Private,Industry Vendor,Leading quantum-safe cryptography vendor; RESQUE consortium member; provides C-QSC quantum-safe cryptographic library compliant with ANSSI and BSI guidelines.,https://ui-avatars.com/api/?name=Ludovic+Barman&background=0b0d17&color=a78bfa&size=128&bold=true,https://www.cryptonext-security.com/,https://www.linkedin.com/in/ludovicbarman/,,,,,,,deprecated,2026-02-22,2026-03-13 leaders policy filter,https://www.cryptonext-security.com/
Patrick Brun,Switzerland,CEO,Kudelski IoT,Private,Industry Vendor,IoT security with PQC implementation; PQCA founding member; provides quantum-safe key lifecycle management for IoT devices.,https://ui-avatars.com/api/?name=Patrick+Brun&background=0b0d17&color=a78bfa&size=128&bold=true,https://www.kudelski-iot.com/,https://www.linkedin.com/in/patrickbrun/,,,,,,,deprecated,2026-02-18,2026-03-13 leaders policy filter,https://www.kudelski-iot.com/solutions/iot-cybersecurity
Stephen Johnson,UK,CEO,Xiphera,Private,Industry Vendor,Hardware cryptographic IP cores including PQC implementations; provides FPGA and ASIC solutions for quantum-safe embedded systems; founded 2017.,https://ui-avtars.com/api/?name=Stephen+Johnson&background=0b0d17&color=a78bfa&size=128&bold=true,https://www.xiphera.com/,https://www.linkedin.com/company/xiphera/,,,,,,,deprecated,2026-02-18,2026-03-13 leaders policy filter,https://www.xiphera.com/products/
Prof. Carlos Hernández-Gómez,USA,Professor,Carnegie Mellon CyLab,Academic,Algorithm Inventor,Advanced PQC research at Carnegie Mellon; contributes to vulnerability analysis of NIST algorithms and quantum-safe protocol development.,https://ui-avatars.com/api/?name=Carlos+Hernandez&background=0b0d17&color=f59e0b&size=128&bold=true,https://www.cylab.cmu.edu/,https://www.linkedin.com/,,,,,,,deprecated,2026-02-18,2026-03-13 leaders policy filter,https://www.cylab.cmu.edu/research/index.html
Prof. Birgitta Whaley,USA,Director,UC Berkeley BQIC,Academic,Standards,Director of Berkeley Quantum Information & Computation Center; focuses on quantum algorithm development and quantum cryptography research.,https://ui-avatars.com/api/?name=Birgitta+Whaley&background=0b0d17&color=60a5fa&size=128&bold=true,https://bqic.berkeley.edu/,https://www.linkedin.com/,,,,,,,deprecated,2026-02-18,2026-03-13 leaders policy filter,https://bqic.berkeley.edu/people/birgitta-whaley
Jérôme Plût,France,Cryptographer,ANSSI (France),Public,Government,Lead technical contributor to ANSSI's PQC transition papers; developed hybridization mandate; defined three-phase timeline with full PQC mandatory by 2030.,https://ui-avatars.com/api/?name=Jerome+Plut&background=0b0d17&color=22d3ee&size=128&bold=true,https://cyber.gouv.fr/en/,https://www.linkedin.com/,,,,,,,deprecated,2026-02-18,2026-03-13 leaders policy filter,https://pkic.org/events/2023/pqc-conference-amsterdam-nl/pkic-pqcc_jerome-plut_anssi_anssi-plan-for-post-quantum-transition.pdf
David Koh,Singapore,Commissioner of Cybersecurity; Chief Executive,CSA Singapore,Public,Government,Founded CSA (2015); launched Quantum-Safe Handbook at SICW 2025; announced CyberCall 2024 with Quantum Safe focus; led S$295M quantum investment.,https://ui-avatars.com/api/?name=David+Koh&background=0b0d17&color=22d3ee&size=128&bold=true,https://www.csa.gov.sg/,https://www.linkedin.com/in/david-koh-21972232/,,,,,,,deprecated,2026-02-18,2026-03-13 leaders policy filter,https://www.csa.gov.sg/resources/publications/quantum-safe-handbook-and-quantum-readiness-index/
Ofra Frenkel,Israel,Chief Government Information Officer,Israel National Digital Agency,Public,Government,Issued 2025 directive requiring all Israeli government bodies to prepare for quantum threats; mandated PQC capabilities in new contracts.,https://ui-avatars.com/api/?name=Ofra+Frenkel&background=0b0d17&color=22d3ee&size=128&bold=true,https://www.gov.il/en/,https://www.linkedin.com/,,,,,,,deprecated,2026-02-18,2026-03-13 leaders policy filter,https://www.ynetnews.com/business/article/h1srzlgqkl
Prof. Dr. Peter Schwabe,Germany,Scientific Director; Professor,MPI-SP; Radboud University,Academic,Algorithm Inventor,"Co-designer of Kyber, Dilithium, and SPHINCS+; three of seven NIST submissions standardized; appointed MPI-SP Director (Apr 2024).",https://ui-avatars.com/api/?name=Peter+Schwabe&background=0b0d17&color=f59e0b&size=128&bold=true,https://cryptojedi.org/peter/index.shtml,https://www.linkedin.com/in/peter-schwabe-b17203b/,,,,,,,deprecated,2026-02-18,2026-03-13 leaders policy filter,https://cryptojedi.org/peter/index.shtml
Prof. Dr. Damien Stehlé,France,Professor,ENS de Lyon,Academic,Algorithm Inventor,Co-designer of Kyber and Dilithium; foundational work on lattice algorithms and security analysis.,https://ui-avatars.com/api/?name=Damien+Stehle&background=0b0d17&color=f59e0b&size=128&bold=true,http://perso.ens-lyon.fr/damien.stehle/,https://www.linkedin.com/,,,,,,,deprecated,2026-02-18,2026-03-13 leaders policy filter,https://cryptojedi.org/papers/dilithium-20170627.pdf
Prof. Dr. Daniel J. Bernstein,USA/Germany,Research Professor,UIC; Ruhr University Bochum CASA,Academic,Algorithm Inventor,Co-designer of SPHINCS+; editor of 'Post-Quantum Cryptography' book; creator of Curve25519; filed FOIA lawsuit against NSA.,https://ui-avatars.com/api/?name=Daniel+Bernstein&background=0b0d17&color=f59e0b&size=128&bold=true,https://cr.yp.to/,https://www.linkedin.com/,,,,,,,deprecated,2026-02-18,2026-03-13 leaders policy filter,https://cr.yp.to/papers.html
